{
  "schema": "ges.bootstrap-closure-evidence.v1",
  "run_id": "20260916T065557Z",
  "started_at": "2026-09-16T06:55:57.604735+00:00",
  "finished_at": "2026-09-16T06:57:16.276192+00:00",
  "ges": {
    "repository": "loudon84/smc-delivery-governance",
    "branch": "feat/ges-v6.0",
    "commit_sha": "d799bdb580f0e206fe5bb75178474d0394116c1e",
    "product_version": "6.0.0-alpha.1",
    "distribution_version": "1.2.1"
  },
  "golden_consumer": {
    "source_path": "E:\\git\\smc-copilot-desktop",
    "repo_identity": "loudon84/smc-copilot-desktop",
    "source_branch": "master",
    "commit_sha": "c8e5dec7671b1bf0e50c01d2b3da45080d6057a0",
    "source_worktree_dirty": true,
    "source_worktree_status_digest": "48a7977ecefa2613f76885521b0678612cf48013e64a5e0e1c81756b24daad97",
    "test_worktree_path": "C:\\Users\\SMC-SZ~1\\AppData\\Local\\Temp\\ges-golden-wt-j83e84m8",
    "test_worktree_clean_at_start": true
  },
  "spec_kit": {
    "repo": "https://github.com/github/spec-kit.git",
    "commit_sha": "1d5106f59e1b148ee23ab136638932dd790ff1b6",
    "specify_cli_version": "1.0.8.dev0",
    "integration": "cursor-agent",
    "official_render_manifest_digest": "",
    "projected_manifest_digest": ""
  },
  "cursor": {
    "executable": "",
    "version": "",
    "structural_discovery": "BLOCKED",
    "runtime_discovery": "BLOCKED"
  },
  "acceptances": [
    {
      "acceptance_id": "A-GOLDEN-001",
      "requirement_ids": [
        "REQ-GOLDEN-001"
      ],
      "test_ids": [
        "TEST-A-GOLDEN-001"
      ],
      "status": "PASS",
      "command": "git rev-parse HEAD",
      "exit_code": 0,
      "oracle": {
        "type": "equals",
        "expected": "E:\\git\\smc-copilot-desktop",
        "actual": "E:\\git\\smc-copilot-desktop"
      },
      "evidence_files": []
    },
    {
      "acceptance_id": "A-GOLDEN-002",
      "requirement_ids": [
        "REQ-GOLDEN-001"
      ],
      "test_ids": [
        "TEST-A-GOLDEN-002"
      ],
      "status": "PASS",
      "command": "git status --porcelain",
      "exit_code": 0,
      "oracle": {
        "type": "equals",
        "expected": "continue-if-dirty",
        "actual": "dirty"
      },
      "evidence_files": []
    },
    {
      "acceptance_id": "A-SK-003",
      "requirement_ids": [
        "REQ-SPECKIT-FUNC-001"
      ],
      "test_ids": [
        "TEST-A-SK-003"
      ],
      "status": "PASS",
      "command": "staging isolation",
      "exit_code": 0,
      "oracle": {
        "type": "equals",
        "expected": true,
        "actual": true
      },
      "evidence_files": []
    },
    {
      "acceptance_id": "A-SK-001",
      "requirement_ids": [
        "REQ-SPECKIT-FUNC-001"
      ],
      "test_ids": [
        "TEST-A-SK-001"
      ],
      "status": "FAIL",
      "command": "ges init",
      "exit_code": 2,
      "oracle": {
        "type": "equals",
        "expected": 0,
        "actual": 2
      },
      "evidence_files": []
    },
    {
      "acceptance_id": "A-GOLDEN-005",
      "requirement_ids": [
        "REQ-GOLDEN-001"
      ],
      "test_ids": [
        "TEST-A-GOLDEN-005"
      ],
      "status": "PASS",
      "command": "source workspace identity",
      "exit_code": 0,
      "oracle": {
        "type": "equals",
        "expected": "unchanged",
        "actual": "unchanged"
      },
      "evidence_files": []
    },
    {
      "acceptance_id": "A-EVID-001",
      "requirement_ids": [
        "REQ-EVID-001"
      ],
      "test_ids": [
        "TEST-A-EVID-001"
      ],
      "status": "PASS",
      "command": "commit binding",
      "exit_code": 0,
      "oracle": {
        "type": "equals",
        "expected": "d799bdb580f0e206fe5bb75178474d0394116c1e",
        "actual": "d799bdb580f0e206fe5bb75178474d0394116c1e"
      },
      "evidence_files": []
    },
    {
      "acceptance_id": "A-EVID-002",
      "requirement_ids": [
        "REQ-EVID-001"
      ],
      "test_ids": [
        "TEST-A-EVID-002"
      ],
      "status": "PASS",
      "command": "per-AC fields",
      "exit_code": 0,
      "oracle": {
        "type": "equals",
        "expected": true,
        "actual": true
      },
      "evidence_files": []
    },
    {
      "acceptance_id": "A-SK-002",
      "requirement_ids": [
        "REQ-SPECKIT-FUNC-001"
      ],
      "test_ids": [
        "TEST-A-SK-002"
      ],
      "status": "BLOCKED",
      "command": "not-executed",
      "exit_code": 2,
      "oracle": {
        "type": "equals",
        "expected": "PASS",
        "actual": "missing"
      },
      "evidence_files": []
    },
    {
      "acceptance_id": "A-SKM-001",
      "requirement_ids": [
        "REQ-SPECKIT-FUNC-002"
      ],
      "test_ids": [
        "TEST-A-SKM-001"
      ],
      "status": "BLOCKED",
      "command": "not-executed",
      "exit_code": 2,
      "oracle": {
        "type": "equals",
        "expected": "PASS",
        "actual": "missing"
      },
      "evidence_files": []
    },
    {
      "acceptance_id": "A-SKM-002",
      "requirement_ids": [
        "REQ-SPECKIT-FUNC-002"
      ],
      "test_ids": [
        "TEST-A-SKM-002"
      ],
      "status": "BLOCKED",
      "command": "not-executed",
      "exit_code": 2,
      "oracle": {
        "type": "equals",
        "expected": "PASS",
        "actual": "missing"
      },
      "evidence_files": []
    },
    {
      "acceptance_id": "A-CURSOR-STRUCT-001",
      "requirement_ids": [
        "REQ-CURSOR-001"
      ],
      "test_ids": [
        "TEST-A-CURSOR-STRUCT-001"
      ],
      "status": "BLOCKED",
      "command": "not-executed",
      "exit_code": 2,
      "oracle": {
        "type": "equals",
        "expected": "PASS",
        "actual": "missing"
      },
      "evidence_files": []
    },
    {
      "acceptance_id": "A-CURSOR-RUNTIME-001",
      "requirement_ids": [
        "REQ-CURSOR-002"
      ],
      "test_ids": [
        "TEST-A-CURSOR-RUNTIME-001"
      ],
      "status": "BLOCKED",
      "command": "not-executed",
      "exit_code": 2,
      "oracle": {
        "type": "equals",
        "expected": "PASS",
        "actual": "missing"
      },
      "evidence_files": []
    },
    {
      "acceptance_id": "A-CURSOR-RUNTIME-002",
      "requirement_ids": [
        "REQ-CURSOR-002"
      ],
      "test_ids": [
        "TEST-A-CURSOR-RUNTIME-002"
      ],
      "status": "BLOCKED",
      "command": "not-executed",
      "exit_code": 2,
      "oracle": {
        "type": "equals",
        "expected": "PASS",
        "actual": "missing"
      },
      "evidence_files": []
    },
    {
      "acceptance_id": "A-SKF-001",
      "requirement_ids": [
        "REQ-SPECKIT-FUNC-003"
      ],
      "test_ids": [
        "TEST-A-SKF-001"
      ],
      "status": "BLOCKED",
      "command": "not-executed",
      "exit_code": 2,
      "oracle": {
        "type": "equals",
        "expected": "PASS",
        "actual": "missing"
      },
      "evidence_files": []
    },
    {
      "acceptance_id": "A-SKF-002",
      "requirement_ids": [
        "REQ-SPECKIT-FUNC-003"
      ],
      "test_ids": [
        "TEST-A-SKF-002"
      ],
      "status": "BLOCKED",
      "command": "not-executed",
      "exit_code": 2,
      "oracle": {
        "type": "equals",
        "expected": "PASS",
        "actual": "missing"
      },
      "evidence_files": []
    },
    {
      "acceptance_id": "A-SKF-003",
      "requirement_ids": [
        "REQ-SPECKIT-FUNC-003"
      ],
      "test_ids": [
        "TEST-A-SKF-003"
      ],
      "status": "BLOCKED",
      "command": "not-executed",
      "exit_code": 2,
      "oracle": {
        "type": "equals",
        "expected": "PASS",
        "actual": "missing"
      },
      "evidence_files": []
    },
    {
      "acceptance_id": "A-GOLDEN-003",
      "requirement_ids": [
        "REQ-GOLDEN-002"
      ],
      "test_ids": [
        "TEST-A-GOLDEN-003"
      ],
      "status": "BLOCKED",
      "command": "not-executed",
      "exit_code": 2,
      "oracle": {
        "type": "equals",
        "expected": "PASS",
        "actual": "missing"
      },
      "evidence_files": []
    },
    {
      "acceptance_id": "A-GOLDEN-004",
      "requirement_ids": [
        "REQ-GOLDEN-002"
      ],
      "test_ids": [
        "TEST-A-GOLDEN-004"
      ],
      "status": "BLOCKED",
      "command": "not-executed",
      "exit_code": 2,
      "oracle": {
        "type": "equals",
        "expected": "PASS",
        "actual": "missing"
      },
      "evidence_files": []
    },
    {
      "acceptance_id": "A-IDEMP-CLI-001",
      "requirement_ids": [
        "REQ-GOLDEN-002"
      ],
      "test_ids": [
        "TEST-A-IDEMP-CLI-001"
      ],
      "status": "BLOCKED",
      "command": "not-executed",
      "exit_code": 2,
      "oracle": {
        "type": "equals",
        "expected": "PASS",
        "actual": "missing"
      },
      "evidence_files": []
    }
  ],
  "release_gate": {
    "status": "FAIL"
  }
}
